{"actor_kind":"automation","admission_id":"admission:v1:cb7fb882fe7eb0c4d20d745666805f9e27da0b83a8dca227c6fbce953f2c8cd9","candidate":{"artifact_id":"candidate:v1:f301894ce2282667f4d874286013abd75a73e7f0e50e3270ba08b671de600d5b","artifact_type":"factory_candidate","content_hash":"sha256:51d7072639332f255679eb1bd77188776789a6f73b8867e7a4384f689ff57368","relative_path":"candidates/candidate:v1:f301894ce2282667f4d874286013abd75a73e7f0e50e3270ba08b671de600d5b.json"},"content_hash":"sha256:201d8807d3674940c83de492d231460559391608965a1cd753b622db9804c917","contract_type":"factory_admission","created_at":"2026-07-27T04:00:01Z","decision":{"artifact_id":"decision:v1:29c140ecd1994611042d916cec3847e9816ca285c16370ad25a009fcba004aa5","artifact_type":"factory_decision","content_hash":"sha256:f6779ddd567e0066ce1a742aad73b267b8e4f74a3316317f445a46833de94c57","relative_path":"decisions/decision:v1:29c140ecd1994611042d916cec3847e9816ca285c16370ad25a009fcba004aa5.json"},"evidence":[{"claims":{"status":"accepted"},"evidence_type":"screening_decision","reference":{"artifact_id":"decision:v1:29c140ecd1994611042d916cec3847e9816ca285c16370ad25a009fcba004aa5","artifact_type":"factory_decision","content_hash":"sha256:f6779ddd567e0066ce1a742aad73b267b8e4f74a3316317f445a46833de94c57","relative_path":"decisions/decision:v1:29c140ecd1994611042d916cec3847e9816ca285c16370ad25a009fcba004aa5.json"}}],"previous_record_hash":"sha256:e3932477a2c974326e642eab715dc841717875440bdd8456fa2a443e867bd975","schema_version":"v1","state":"screened","task":null,"transition_reason":"Factory promotion advanced to screened."}