{"actor_kind":"human","admission_id":"admission:v1:64c288b216607369ffcf2bcc64c6aadc921178beedae99b2736af7a16cb0bb8a","candidate":{"artifact_id":"candidate:v1:ba1765f4dcd4fa157ff3ed9fadbec9f21aeced8922794fb31a9965f11210c65a","artifact_type":"factory_candidate","content_hash":"sha256:23d65e20e10f6d4b9c6e2ef65fa4ab44e6efee8e9eb160c5ff9c9dcb32868936","relative_path":"candidates/candidate:v1:ba1765f4dcd4fa157ff3ed9fadbec9f21aeced8922794fb31a9965f11210c65a.json"},"content_hash":"sha256:21754e0dd9b6351f43c7ad6d0ae9fd1d1990fad57d508127143f0c9fa81056b3","contract_type":"factory_admission","created_at":"2026-07-27T04:00:01Z","decision":{"artifact_id":"decision:v1:83bd88540a51dfaf7c817a96d9158c8b0f4c99b4109626a95898daa773e3e8c3","artifact_type":"factory_decision","content_hash":"sha256:3682bccf98acc187308bb108bb0e663b668960ed8104307418c7a7e916baa4ee","relative_path":"decisions/decision:v1:83bd88540a51dfaf7c817a96d9158c8b0f4c99b4109626a95898daa773e3e8c3.json"},"evidence":[{"claims":{"fail_to_pass_passed":0,"fail_to_pass_total":1,"pass_to_pass_passed":1,"pass_to_pass_total":1,"runtime_hash":"sha256:65fc1cfe19c42b7ffdea756f58a57a05ef5e605688c37531f249ae0ddbe3af3d","selector_hash":"sha256:3e249cae807ea77f1d3e727425264d5dfa3b88de6a6728ef998ebc1928922942","source_hash":"sha256:2420fe7d84cedc94d3c8c2b469683a60454a0a2507693e9d62d5f1e07d2d71c5","status":"failed_as_expected"},"evidence_type":"baseline","reference":{"artifact_id":"source:pytorch__126461__cummin_rank_zero","artifact_type":"source","content_hash":"sha256:2420fe7d84cedc94d3c8c2b469683a60454a0a2507693e9d62d5f1e07d2d71c5","relative_path":"evidence/pytorch__126461__cummin_rank_zero/source.json"}},{"claims":{"fail_to_pass_passed":1,"fail_to_pass_total":1,"pass_to_pass_passed":1,"pass_to_pass_total":1,"runtime_hash":"sha256:65fc1cfe19c42b7ffdea756f58a57a05ef5e605688c37531f249ae0ddbe3af3d","selector_hash":"sha256:3e249cae807ea77f1d3e727425264d5dfa3b88de6a6728ef998ebc1928922942","source_hash":"sha256:2420fe7d84cedc94d3c8c2b469683a60454a0a2507693e9d62d5f1e07d2d71c5","status":"resolved"},"evidence_type":"gold","reference":{"artifact_id":"pytorch__126461__cummin_rank_zero:3217fd798937:2026-07-26T22:10:55Z","artifact_type":"admission_evidence","content_hash":"sha256:65c3d0f9450521a80b74a133b1e04a4167c819db5366b84d67773a9ecf655c66","relative_path":"evidence/pytorch__126461__cummin_rank_zero/admission.json"}},{"claims":{"reviewed_at":"2026-07-27T04:00:00Z","reviewer":"op-bench-v0.7-human-review","status":"approved"},"evidence_type":"human_review","reference":{"artifact_id":"review:pytorch__126461__cummin_rank_zero","artifact_type":"human_review","content_hash":"sha256:de3bc7fa3bbefe07c3800f7bedc9ee353f63fe102dec3a90e985d961c9c54a47","relative_path":"reviews/pytorch__126461__cummin_rank_zero.json"}},{"claims":{"runtime_hash":"sha256:65fc1cfe19c42b7ffdea756f58a57a05ef5e605688c37531f249ae0ddbe3af3d","selector_hash":"sha256:3e249cae807ea77f1d3e727425264d5dfa3b88de6a6728ef998ebc1928922942","source_hash":"sha256:2420fe7d84cedc94d3c8c2b469683a60454a0a2507693e9d62d5f1e07d2d71c5","status":"passed"},"evidence_type":"integrity","reference":{"artifact_id":"integrity:pytorch__126461__cummin_rank_zero","artifact_type":"integrity","content_hash":"sha256:155febc9ab15147d80c9a86fed62bddcd7ca946e2b13175735258b9497ac965e","relative_path":"integrity/pytorch__126461__cummin_rank_zero.json"}},{"claims":{"runtime_hash":"sha256:65fc1cfe19c42b7ffdea756f58a57a05ef5e605688c37531f249ae0ddbe3af3d","source_hash":"sha256:2420fe7d84cedc94d3c8c2b469683a60454a0a2507693e9d62d5f1e07d2d71c5","status":"passed"},"evidence_type":"preflight","reference":{"artifact_id":"environment:pytorch__126461__cummin_rank_zero","artifact_type":"environment","content_hash":"sha256:65fc1cfe19c42b7ffdea756f58a57a05ef5e605688c37531f249ae0ddbe3af3d","relative_path":"evidence/pytorch__126461__cummin_rank_zero/environment.json"}},{"claims":{"status":"accepted"},"evidence_type":"screening_decision","reference":{"artifact_id":"decision:v1:83bd88540a51dfaf7c817a96d9158c8b0f4c99b4109626a95898daa773e3e8c3","artifact_type":"factory_decision","content_hash":"sha256:3682bccf98acc187308bb108bb0e663b668960ed8104307418c7a7e916baa4ee","relative_path":"decisions/decision:v1:83bd88540a51dfaf7c817a96d9158c8b0f4c99b4109626a95898daa773e3e8c3.json"}},{"claims":{"status":"complete","task_id":"pytorch__126461__cummin_rank_zero"},"evidence_type":"task_bundle","reference":{"artifact_id":"task:pytorch__126461__cummin_rank_zero","artifact_type":"task_bundle","content_hash":"sha256:27539e3ab731600624d8ad37153bb0c3f163c57058c51cb8584d15eab9a3f694","relative_path":"tasks/pytorch__126461__cummin_rank_zero/task.json"}}],"previous_record_hash":"sha256:c6ee6359e0a4dd9944a6853d7f1bf027d9a86c08a399fd088596da629941d3ca","schema_version":"v1","state":"verified","task":{"artifact_id":"task:pytorch__126461__cummin_rank_zero","artifact_type":"task_bundle","content_hash":"sha256:27539e3ab731600624d8ad37153bb0c3f163c57058c51cb8584d15eab9a3f694","relative_path":"tasks/pytorch__126461__cummin_rank_zero/task.json"},"transition_reason":"Factory promotion advanced to verified."}