{"actor_kind":"automation","admission_id":"admission:v1:05b46a2e047d053c816fa6dfd7e4279c12693bdb12561fe94d6affbbb2a01e0a","candidate":{"artifact_id":"candidate:v1:31e86f0b12452c2b141103ab706292e682fd60bde55dcb62f166e1f0933141e9","artifact_type":"factory_candidate","content_hash":"sha256:38517cc582378b3c3b0fb6d91a0f514052914d896a9624aec8f6964c1b45692c","relative_path":"candidates/candidate:v1:31e86f0b12452c2b141103ab706292e682fd60bde55dcb62f166e1f0933141e9.json"},"content_hash":"sha256:1dfe13c0e62989741086d712252b87f47a60c1c8d1645dd6cb31abbbe9c0bc78","contract_type":"factory_admission","created_at":"2026-07-27T04:00:01Z","decision":{"artifact_id":"decision:v1:afeb5adeab734bd7ccc83201f475cf824285eccd4fe07c404f93866b85550194","artifact_type":"factory_decision","content_hash":"sha256:2cb3f90fd2fb0acfd9b99168eb7e63383c76ac416dae0dfe2c15d97153df17e6","relative_path":"decisions/decision:v1:afeb5adeab734bd7ccc83201f475cf824285eccd4fe07c404f93866b85550194.json"},"evidence":[{"claims":{"runtime_hash":"sha256:50899c9e1d609264c5266695b960f3644214577bd4bcdb393bf2827aed13418b","source_hash":"sha256:f6619798116de2a26be0fa61c74eb20f06eba8a65fd61e5342a8ad60c869ae64","status":"passed"},"evidence_type":"preflight","reference":{"artifact_id":"environment:pytorch__147352__storage_offset_overflow","artifact_type":"environment","content_hash":"sha256:50899c9e1d609264c5266695b960f3644214577bd4bcdb393bf2827aed13418b","relative_path":"evidence/pytorch__147352__storage_offset_overflow/environment.json"}},{"claims":{"status":"accepted"},"evidence_type":"screening_decision","reference":{"artifact_id":"decision:v1:afeb5adeab734bd7ccc83201f475cf824285eccd4fe07c404f93866b85550194","artifact_type":"factory_decision","content_hash":"sha256:2cb3f90fd2fb0acfd9b99168eb7e63383c76ac416dae0dfe2c15d97153df17e6","relative_path":"decisions/decision:v1:afeb5adeab734bd7ccc83201f475cf824285eccd4fe07c404f93866b85550194.json"}},{"claims":{"status":"complete","task_id":"pytorch__147352__storage_offset_overflow"},"evidence_type":"task_bundle","reference":{"artifact_id":"task:pytorch__147352__storage_offset_overflow","artifact_type":"task_bundle","content_hash":"sha256:aeadff0e2d4b00016ee24a786b0e82731618b5db2e4987a80fcb77de5907e39c","relative_path":"tasks/pytorch__147352__storage_offset_overflow/task.json"}}],"previous_record_hash":"sha256:9573f5a65c480a0cbe8eb6e5aa0063c6627bc82bb1fdcb324afc41008e3985eb","schema_version":"v1","state":"preflight_passed","task":{"artifact_id":"task:pytorch__147352__storage_offset_overflow","artifact_type":"task_bundle","content_hash":"sha256:aeadff0e2d4b00016ee24a786b0e82731618b5db2e4987a80fcb77de5907e39c","relative_path":"tasks/pytorch__147352__storage_offset_overflow/task.json"},"transition_reason":"Factory promotion advanced to preflight_passed."}