{"actor_kind":"human","admission_id":"admission:v1:da5c34072b9322523e2deb89999b11ce4f268b013a0ec7a80b316347d2372394","candidate":{"artifact_id":"candidate:v1:aae04fe74b4c418c18ac68283b57b16757e6f6747afc4188db4b3a0fcdea3373","artifact_type":"factory_candidate","content_hash":"sha256:88fb70388a8759692409ab8bfc797845c6c833c8798b4d5dd37952cf936190b5","relative_path":"candidates/candidate:v1:aae04fe74b4c418c18ac68283b57b16757e6f6747afc4188db4b3a0fcdea3373.json"},"content_hash":"sha256:1963ad379ace769e1469ac13ae8fb12262bc581cd1b6a4da4c6b5bd563070864","contract_type":"factory_admission","created_at":"2026-07-27T04:00:01Z","decision":{"artifact_id":"decision:v1:583dc9f60115b2766eb795d4b78128ce8bc69fff6dd2d9c1e510d2042cffd752","artifact_type":"factory_decision","content_hash":"sha256:e942c3a57d7cfaf91538d6645d4f9b0562c17813c5c47e58b3e1679cff94c56f","relative_path":"decisions/decision:v1:583dc9f60115b2766eb795d4b78128ce8bc69fff6dd2d9c1e510d2042cffd752.json"},"evidence":[{"claims":{"fail_to_pass_passed":0,"fail_to_pass_total":1,"pass_to_pass_passed":1,"pass_to_pass_total":1,"runtime_hash":"sha256:b103d6cce3d9657c21d685b728a5f3bbb329e630867aadd2944e4492f6c4f63f","selector_hash":"sha256:395d11d35863b67fe31b28f57e72b48ffcd48cc8ef0cea98367d88b8735f4ba9","source_hash":"sha256:06923f1ddef1ebbb1d8170d03020d367893a42c900dd467de89e26b36af5288c","status":"failed_as_expected"},"evidence_type":"baseline","reference":{"artifact_id":"source:pytorch__118762__weight_norm_default_dim","artifact_type":"source","content_hash":"sha256:06923f1ddef1ebbb1d8170d03020d367893a42c900dd467de89e26b36af5288c","relative_path":"evidence/pytorch__118762__weight_norm_default_dim/source.json"}},{"claims":{"fail_to_pass_passed":1,"fail_to_pass_total":1,"pass_to_pass_passed":1,"pass_to_pass_total":1,"runtime_hash":"sha256:b103d6cce3d9657c21d685b728a5f3bbb329e630867aadd2944e4492f6c4f63f","selector_hash":"sha256:395d11d35863b67fe31b28f57e72b48ffcd48cc8ef0cea98367d88b8735f4ba9","source_hash":"sha256:06923f1ddef1ebbb1d8170d03020d367893a42c900dd467de89e26b36af5288c","status":"resolved"},"evidence_type":"gold","reference":{"artifact_id":"pytorch__118762__weight_norm_default_dim:fef7fef9b9a4:2026-07-26T22:13:57Z","artifact_type":"admission_evidence","content_hash":"sha256:ef444b0fb1e0c439bbddad59f2fc84d4672aeab03095c08c37341ba039159ee9","relative_path":"evidence/pytorch__118762__weight_norm_default_dim/admission.json"}},{"claims":{"reviewed_at":"2026-07-27T04:00:00Z","reviewer":"op-bench-v0.7-human-review","status":"approved"},"evidence_type":"human_review","reference":{"artifact_id":"review:pytorch__118762__weight_norm_default_dim","artifact_type":"human_review","content_hash":"sha256:fe5c7b90625189e9161b39b74267f8ec29991cd914b4aa3d0ab672320bd81d6d","relative_path":"reviews/pytorch__118762__weight_norm_default_dim.json"}},{"claims":{"runtime_hash":"sha256:b103d6cce3d9657c21d685b728a5f3bbb329e630867aadd2944e4492f6c4f63f","selector_hash":"sha256:395d11d35863b67fe31b28f57e72b48ffcd48cc8ef0cea98367d88b8735f4ba9","source_hash":"sha256:06923f1ddef1ebbb1d8170d03020d367893a42c900dd467de89e26b36af5288c","status":"passed"},"evidence_type":"integrity","reference":{"artifact_id":"integrity:pytorch__118762__weight_norm_default_dim","artifact_type":"integrity","content_hash":"sha256:2a51cf9f79cfff802b0fe467c110a33a7656b483aceb4d069c0ee41577e788ac","relative_path":"integrity/pytorch__118762__weight_norm_default_dim.json"}},{"claims":{"runtime_hash":"sha256:b103d6cce3d9657c21d685b728a5f3bbb329e630867aadd2944e4492f6c4f63f","source_hash":"sha256:06923f1ddef1ebbb1d8170d03020d367893a42c900dd467de89e26b36af5288c","status":"passed"},"evidence_type":"preflight","reference":{"artifact_id":"environment:pytorch__118762__weight_norm_default_dim","artifact_type":"environment","content_hash":"sha256:b103d6cce3d9657c21d685b728a5f3bbb329e630867aadd2944e4492f6c4f63f","relative_path":"evidence/pytorch__118762__weight_norm_default_dim/environment.json"}},{"claims":{"status":"accepted"},"evidence_type":"screening_decision","reference":{"artifact_id":"decision:v1:583dc9f60115b2766eb795d4b78128ce8bc69fff6dd2d9c1e510d2042cffd752","artifact_type":"factory_decision","content_hash":"sha256:e942c3a57d7cfaf91538d6645d4f9b0562c17813c5c47e58b3e1679cff94c56f","relative_path":"decisions/decision:v1:583dc9f60115b2766eb795d4b78128ce8bc69fff6dd2d9c1e510d2042cffd752.json"}},{"claims":{"status":"complete","task_id":"pytorch__118762__weight_norm_default_dim"},"evidence_type":"task_bundle","reference":{"artifact_id":"task:pytorch__118762__weight_norm_default_dim","artifact_type":"task_bundle","content_hash":"sha256:128f2e01c37db67efdadc00845e99c0b9ef663a5a9a057b7a7cf9618ac1c0edb","relative_path":"tasks/pytorch__118762__weight_norm_default_dim/task.json"}}],"previous_record_hash":"sha256:228c61769fb5ea82e9e853c6647b6b2bc9e8d8879f51297c721a6bca79d2973a","schema_version":"v1","state":"verified","task":{"artifact_id":"task:pytorch__118762__weight_norm_default_dim","artifact_type":"task_bundle","content_hash":"sha256:128f2e01c37db67efdadc00845e99c0b9ef663a5a9a057b7a7cf9618ac1c0edb","relative_path":"tasks/pytorch__118762__weight_norm_default_dim/task.json"},"transition_reason":"Factory promotion advanced to verified."}