{"actor_kind":"automation","admission_id":"admission:v1:5363f72d6298585d980e0303128729196f66fae692a5d0b6f51d8c4961a8fcec","candidate":{"artifact_id":"candidate:v1:aae04fe74b4c418c18ac68283b57b16757e6f6747afc4188db4b3a0fcdea3373","artifact_type":"factory_candidate","content_hash":"sha256:88fb70388a8759692409ab8bfc797845c6c833c8798b4d5dd37952cf936190b5","relative_path":"candidates/candidate:v1:aae04fe74b4c418c18ac68283b57b16757e6f6747afc4188db4b3a0fcdea3373.json"},"content_hash":"sha256:966e01abfc6ee7e41526ac6dab7d040faf696a0b5c98bdcdb7d55daad0e7274b","contract_type":"factory_admission","created_at":"2026-07-27T04:00:01Z","decision":{"artifact_id":"decision:v1:583dc9f60115b2766eb795d4b78128ce8bc69fff6dd2d9c1e510d2042cffd752","artifact_type":"factory_decision","content_hash":"sha256:e942c3a57d7cfaf91538d6645d4f9b0562c17813c5c47e58b3e1679cff94c56f","relative_path":"decisions/decision:v1:583dc9f60115b2766eb795d4b78128ce8bc69fff6dd2d9c1e510d2042cffd752.json"},"evidence":[{"claims":{"fail_to_pass_passed":0,"fail_to_pass_total":1,"pass_to_pass_passed":1,"pass_to_pass_total":1,"runtime_hash":"sha256:b103d6cce3d9657c21d685b728a5f3bbb329e630867aadd2944e4492f6c4f63f","selector_hash":"sha256:395d11d35863b67fe31b28f57e72b48ffcd48cc8ef0cea98367d88b8735f4ba9","source_hash":"sha256:06923f1ddef1ebbb1d8170d03020d367893a42c900dd467de89e26b36af5288c","status":"failed_as_expected"},"evidence_type":"baseline","reference":{"artifact_id":"source:pytorch__118762__weight_norm_default_dim","artifact_type":"source","content_hash":"sha256:06923f1ddef1ebbb1d8170d03020d367893a42c900dd467de89e26b36af5288c","relative_path":"evidence/pytorch__118762__weight_norm_default_dim/source.json"}},{"claims":{"runtime_hash":"sha256:b103d6cce3d9657c21d685b728a5f3bbb329e630867aadd2944e4492f6c4f63f","source_hash":"sha256:06923f1ddef1ebbb1d8170d03020d367893a42c900dd467de89e26b36af5288c","status":"passed"},"evidence_type":"preflight","reference":{"artifact_id":"environment:pytorch__118762__weight_norm_default_dim","artifact_type":"environment","content_hash":"sha256:b103d6cce3d9657c21d685b728a5f3bbb329e630867aadd2944e4492f6c4f63f","relative_path":"evidence/pytorch__118762__weight_norm_default_dim/environment.json"}},{"claims":{"status":"accepted"},"evidence_type":"screening_decision","reference":{"artifact_id":"decision:v1:583dc9f60115b2766eb795d4b78128ce8bc69fff6dd2d9c1e510d2042cffd752","artifact_type":"factory_decision","content_hash":"sha256:e942c3a57d7cfaf91538d6645d4f9b0562c17813c5c47e58b3e1679cff94c56f","relative_path":"decisions/decision:v1:583dc9f60115b2766eb795d4b78128ce8bc69fff6dd2d9c1e510d2042cffd752.json"}},{"claims":{"status":"complete","task_id":"pytorch__118762__weight_norm_default_dim"},"evidence_type":"task_bundle","reference":{"artifact_id":"task:pytorch__118762__weight_norm_default_dim","artifact_type":"task_bundle","content_hash":"sha256:128f2e01c37db67efdadc00845e99c0b9ef663a5a9a057b7a7cf9618ac1c0edb","relative_path":"tasks/pytorch__118762__weight_norm_default_dim/task.json"}}],"previous_record_hash":"sha256:38e0f0db44ac0c2be7e609873c462505812c1f23e1767cf2229d07341301784c","schema_version":"v1","state":"baseline_reproduced","task":{"artifact_id":"task:pytorch__118762__weight_norm_default_dim","artifact_type":"task_bundle","content_hash":"sha256:128f2e01c37db67efdadc00845e99c0b9ef663a5a9a057b7a7cf9618ac1c0edb","relative_path":"tasks/pytorch__118762__weight_norm_default_dim/task.json"},"transition_reason":"Factory promotion advanced to baseline_reproduced."}