{"actor_kind":"human","admission_id":"admission:v1:5ed18d678c9db2e4491e05f553df618b836b5f491914d3b39058f1ea1632220f","candidate":{"artifact_id":"candidate:v1:486b8bd7dad210611318f2291871c8dba3493d3ef2d435739776aa66e472c920","artifact_type":"factory_candidate","content_hash":"sha256:a7f7f29a68c7ec1991c1f062ce52e3fab2b622062825786ad081b917a10bf0a1","relative_path":"candidates/candidate:v1:486b8bd7dad210611318f2291871c8dba3493d3ef2d435739776aa66e472c920.json"},"content_hash":"sha256:f402fa77c762c524a2854f2b0acf563452ab90c996bea91f0fba549b21446967","contract_type":"factory_admission","created_at":"2026-07-27T04:00:01Z","decision":{"artifact_id":"decision:v1:02e03f6c8b8c0e70763497ee5db24da03a796616d410ef8544bc2fa86240b073","artifact_type":"factory_decision","content_hash":"sha256:240cb7740b61b593441a87e55e3516caaf7e570f9cf3940f1de0a57d816c16c1","relative_path":"decisions/decision:v1:02e03f6c8b8c0e70763497ee5db24da03a796616d410ef8544bc2fa86240b073.json"},"evidence":[{"claims":{"fail_to_pass_passed":0,"fail_to_pass_total":1,"pass_to_pass_passed":1,"pass_to_pass_total":1,"runtime_hash":"sha256:7c5861486157f5b63cac2e871f7fff91610c100c682cbfe81716c99da3aeace0","selector_hash":"sha256:b5902846fe230cbff662ba290b553a7febbe53c90c943e303c78334a75662253","source_hash":"sha256:92c5db080e924d7bf6f1ad740529e6c798fdfbbcd113f59b29ddfe59b340606a","status":"failed_as_expected"},"evidence_type":"baseline","reference":{"artifact_id":"source:pytorch__139751__triton_ygrid_mask","artifact_type":"source","content_hash":"sha256:92c5db080e924d7bf6f1ad740529e6c798fdfbbcd113f59b29ddfe59b340606a","relative_path":"evidence/pytorch__139751__triton_ygrid_mask/source.json"}},{"claims":{"fail_to_pass_passed":1,"fail_to_pass_total":1,"pass_to_pass_passed":1,"pass_to_pass_total":1,"runtime_hash":"sha256:7c5861486157f5b63cac2e871f7fff91610c100c682cbfe81716c99da3aeace0","selector_hash":"sha256:b5902846fe230cbff662ba290b553a7febbe53c90c943e303c78334a75662253","source_hash":"sha256:92c5db080e924d7bf6f1ad740529e6c798fdfbbcd113f59b29ddfe59b340606a","status":"resolved"},"evidence_type":"gold","reference":{"artifact_id":"pytorch__139751__triton_ygrid_mask:bf321f027c1b:2026-07-26T22:16:39Z","artifact_type":"admission_evidence","content_hash":"sha256:eeb562f6713b644695d0596f25596d907996769796d63d9fb58853c8093e9b1e","relative_path":"evidence/pytorch__139751__triton_ygrid_mask/admission.json"}},{"claims":{"reviewed_at":"2026-07-27T04:00:00Z","reviewer":"op-bench-v0.7-human-review","status":"approved"},"evidence_type":"human_review","reference":{"artifact_id":"review:pytorch__139751__triton_ygrid_mask","artifact_type":"human_review","content_hash":"sha256:c68152835018c714d0a94aee89db4099e59f23fce231d440a244e13b42387fa3","relative_path":"reviews/pytorch__139751__triton_ygrid_mask.json"}},{"claims":{"runtime_hash":"sha256:7c5861486157f5b63cac2e871f7fff91610c100c682cbfe81716c99da3aeace0","source_hash":"sha256:92c5db080e924d7bf6f1ad740529e6c798fdfbbcd113f59b29ddfe59b340606a","status":"passed"},"evidence_type":"preflight","reference":{"artifact_id":"environment:pytorch__139751__triton_ygrid_mask","artifact_type":"environment","content_hash":"sha256:7c5861486157f5b63cac2e871f7fff91610c100c682cbfe81716c99da3aeace0","relative_path":"evidence/pytorch__139751__triton_ygrid_mask/environment.json"}},{"claims":{"status":"accepted"},"evidence_type":"screening_decision","reference":{"artifact_id":"decision:v1:02e03f6c8b8c0e70763497ee5db24da03a796616d410ef8544bc2fa86240b073","artifact_type":"factory_decision","content_hash":"sha256:240cb7740b61b593441a87e55e3516caaf7e570f9cf3940f1de0a57d816c16c1","relative_path":"decisions/decision:v1:02e03f6c8b8c0e70763497ee5db24da03a796616d410ef8544bc2fa86240b073.json"}},{"claims":{"status":"complete","task_id":"pytorch__139751__triton_ygrid_mask"},"evidence_type":"task_bundle","reference":{"artifact_id":"task:pytorch__139751__triton_ygrid_mask","artifact_type":"task_bundle","content_hash":"sha256:abaf5b8fd219a9da7d3f4b6c815bbf5a9b4896c55708c5b7aa290eac698a6fb9","relative_path":"tasks/pytorch__139751__triton_ygrid_mask/task.json"}}],"previous_record_hash":"sha256:c79bfa0d9be4f96c62edf6fa98e73e9256124ef646369c2ec68daf661e44db39","schema_version":"v1","state":"reviewed","task":{"artifact_id":"task:pytorch__139751__triton_ygrid_mask","artifact_type":"task_bundle","content_hash":"sha256:abaf5b8fd219a9da7d3f4b6c815bbf5a9b4896c55708c5b7aa290eac698a6fb9","relative_path":"tasks/pytorch__139751__triton_ygrid_mask/task.json"},"transition_reason":"Factory promotion advanced to reviewed."}