{"actor_kind":"automation","admission_id":"admission:v1:2f6fcd99d7ee56100cb868d81f3c4fd5ad4eaba65937153150b8e66c65dc4ae2","candidate":{"artifact_id":"candidate:v1:f301894ce2282667f4d874286013abd75a73e7f0e50e3270ba08b671de600d5b","artifact_type":"factory_candidate","content_hash":"sha256:51d7072639332f255679eb1bd77188776789a6f73b8867e7a4384f689ff57368","relative_path":"candidates/candidate:v1:f301894ce2282667f4d874286013abd75a73e7f0e50e3270ba08b671de600d5b.json"},"content_hash":"sha256:f7a5cee7e4bb6607989f73868f901a4b93a4ad11e24d1cdcb2dc3c188fed5fee","contract_type":"factory_admission","created_at":"2026-07-27T04:00:01Z","decision":{"artifact_id":"decision:v1:29c140ecd1994611042d916cec3847e9816ca285c16370ad25a009fcba004aa5","artifact_type":"factory_decision","content_hash":"sha256:f6779ddd567e0066ce1a742aad73b267b8e4f74a3316317f445a46833de94c57","relative_path":"decisions/decision:v1:29c140ecd1994611042d916cec3847e9816ca285c16370ad25a009fcba004aa5.json"},"evidence":[{"claims":{"status":"accepted"},"evidence_type":"screening_decision","reference":{"artifact_id":"decision:v1:29c140ecd1994611042d916cec3847e9816ca285c16370ad25a009fcba004aa5","artifact_type":"factory_decision","content_hash":"sha256:f6779ddd567e0066ce1a742aad73b267b8e4f74a3316317f445a46833de94c57","relative_path":"decisions/decision:v1:29c140ecd1994611042d916cec3847e9816ca285c16370ad25a009fcba004aa5.json"}},{"claims":{"status":"complete","task_id":"pytorch__143792__addmv_empty_matrix"},"evidence_type":"task_bundle","reference":{"artifact_id":"task:pytorch__143792__addmv_empty_matrix","artifact_type":"task_bundle","content_hash":"sha256:6393e479b12b4f0e5a12b49086b4abab2a155cecc29abcad296c743bb80dadd7","relative_path":"tasks/pytorch__143792__addmv_empty_matrix/task.json"}}],"previous_record_hash":"sha256:201d8807d3674940c83de492d231460559391608965a1cd753b622db9804c917","schema_version":"v1","state":"bundled","task":{"artifact_id":"task:pytorch__143792__addmv_empty_matrix","artifact_type":"task_bundle","content_hash":"sha256:6393e479b12b4f0e5a12b49086b4abab2a155cecc29abcad296c743bb80dadd7","relative_path":"tasks/pytorch__143792__addmv_empty_matrix/task.json"},"transition_reason":"Factory promotion advanced to bundled."}