{"actor_kind":"human","admission_id":"admission:v1:7cc18007fb7054e5c6d6e0e8713d51f6c7cbaa2ce6cf8b6a60c007becb6cd9ce","candidate":{"artifact_id":"candidate:v1:31e86f0b12452c2b141103ab706292e682fd60bde55dcb62f166e1f0933141e9","artifact_type":"factory_candidate","content_hash":"sha256:38517cc582378b3c3b0fb6d91a0f514052914d896a9624aec8f6964c1b45692c","relative_path":"candidates/candidate:v1:31e86f0b12452c2b141103ab706292e682fd60bde55dcb62f166e1f0933141e9.json"},"content_hash":"sha256:895f300704777bb8538382762ccff54df72534ac650f600f38a25a186e405178","contract_type":"factory_admission","created_at":"2026-07-27T04:00:01Z","decision":{"artifact_id":"decision:v1:afeb5adeab734bd7ccc83201f475cf824285eccd4fe07c404f93866b85550194","artifact_type":"factory_decision","content_hash":"sha256:2cb3f90fd2fb0acfd9b99168eb7e63383c76ac416dae0dfe2c15d97153df17e6","relative_path":"decisions/decision:v1:afeb5adeab734bd7ccc83201f475cf824285eccd4fe07c404f93866b85550194.json"},"evidence":[{"claims":{"fail_to_pass_passed":0,"fail_to_pass_total":1,"pass_to_pass_passed":1,"pass_to_pass_total":1,"runtime_hash":"sha256:594453294b0955e925091a87e2077e00fd4172af326de645f751357837f131be","selector_hash":"sha256:43b8b6cf9aeb183d189172c119c6cd100c5a80b63f2848c6528692a70bd5df76","source_hash":"sha256:f6619798116de2a26be0fa61c74eb20f06eba8a65fd61e5342a8ad60c869ae64","status":"failed_as_expected"},"evidence_type":"baseline","reference":{"artifact_id":"source:pytorch__147352__storage_offset_overflow","artifact_type":"source","content_hash":"sha256:f6619798116de2a26be0fa61c74eb20f06eba8a65fd61e5342a8ad60c869ae64","relative_path":"evidence/pytorch__147352__storage_offset_overflow/source.json"}},{"claims":{"fail_to_pass_passed":1,"fail_to_pass_total":1,"pass_to_pass_passed":1,"pass_to_pass_total":1,"runtime_hash":"sha256:594453294b0955e925091a87e2077e00fd4172af326de645f751357837f131be","selector_hash":"sha256:43b8b6cf9aeb183d189172c119c6cd100c5a80b63f2848c6528692a70bd5df76","source_hash":"sha256:f6619798116de2a26be0fa61c74eb20f06eba8a65fd61e5342a8ad60c869ae64","status":"resolved"},"evidence_type":"gold","reference":{"artifact_id":"pytorch__147352__storage_offset_overflow:95c4e9f73ec3:2026-07-26T22:46:03Z","artifact_type":"admission_evidence","content_hash":"sha256:ac53e9bbcfcf98fd860a790ba5e8635b8ed686ce8013fd7672a6356cb029a01e","relative_path":"evidence/pytorch__147352__storage_offset_overflow/admission.json"}},{"claims":{"reviewed_at":"2026-07-27T04:00:00Z","reviewer":"op-bench-v0.7-human-review","status":"approved"},"evidence_type":"human_review","reference":{"artifact_id":"review:pytorch__147352__storage_offset_overflow","artifact_type":"human_review","content_hash":"sha256:6c63eb6eaebe491a2d985a031ec30a59f6f7a4a92190e2118a85ef5fde1be49c","relative_path":"reviews/pytorch__147352__storage_offset_overflow.json"}},{"claims":{"runtime_hash":"sha256:594453294b0955e925091a87e2077e00fd4172af326de645f751357837f131be","selector_hash":"sha256:43b8b6cf9aeb183d189172c119c6cd100c5a80b63f2848c6528692a70bd5df76","source_hash":"sha256:f6619798116de2a26be0fa61c74eb20f06eba8a65fd61e5342a8ad60c869ae64","status":"passed"},"evidence_type":"integrity","reference":{"artifact_id":"integrity:pytorch__147352__storage_offset_overflow","artifact_type":"integrity","content_hash":"sha256:a9b106c633e8d20d238ec7211549a654f593fd6ca7a13de3781779156361a767","relative_path":"integrity/pytorch__147352__storage_offset_overflow.json"}},{"claims":{"runtime_hash":"sha256:594453294b0955e925091a87e2077e00fd4172af326de645f751357837f131be","source_hash":"sha256:f6619798116de2a26be0fa61c74eb20f06eba8a65fd61e5342a8ad60c869ae64","status":"passed"},"evidence_type":"preflight","reference":{"artifact_id":"environment:pytorch__147352__storage_offset_overflow","artifact_type":"environment","content_hash":"sha256:594453294b0955e925091a87e2077e00fd4172af326de645f751357837f131be","relative_path":"evidence/pytorch__147352__storage_offset_overflow/environment.json"}},{"claims":{"status":"accepted"},"evidence_type":"screening_decision","reference":{"artifact_id":"decision:v1:afeb5adeab734bd7ccc83201f475cf824285eccd4fe07c404f93866b85550194","artifact_type":"factory_decision","content_hash":"sha256:2cb3f90fd2fb0acfd9b99168eb7e63383c76ac416dae0dfe2c15d97153df17e6","relative_path":"decisions/decision:v1:afeb5adeab734bd7ccc83201f475cf824285eccd4fe07c404f93866b85550194.json"}},{"claims":{"status":"complete","task_id":"pytorch__147352__storage_offset_overflow"},"evidence_type":"task_bundle","reference":{"artifact_id":"task:pytorch__147352__storage_offset_overflow","artifact_type":"task_bundle","content_hash":"sha256:a86780739ab2845710b2c431908efeb918217e5f81c7d7d2c1a118271ff4fbaa","relative_path":"tasks/pytorch__147352__storage_offset_overflow/task.json"}}],"previous_record_hash":"sha256:b66cd37f035b12ebbeb58fe964809c467c9c1c9ad5a1fa72cdf4b0f9a66b4189","schema_version":"v1","state":"verified","task":{"artifact_id":"task:pytorch__147352__storage_offset_overflow","artifact_type":"task_bundle","content_hash":"sha256:a86780739ab2845710b2c431908efeb918217e5f81c7d7d2c1a118271ff4fbaa","relative_path":"tasks/pytorch__147352__storage_offset_overflow/task.json"},"transition_reason":"Factory promotion advanced to verified."}